"No.","Time","Source","Destination","Protocol","Length","Info"
"553","22.998874","fe80::200:ff:fe00:51","fe80::200:ff:fe00:2","TCP","112","49153  >  8080 [SYN] Seq=0 Win=32768 Len=0 WS=4 TSval=23000 TSecr=0"
"555","23.001798","fe80::200:ff:fe00:43","fe80::200:ff:fe00:51","ICMPv6","160","Destination Unreachable (no route to destination)"
"819","28.998874","fe80::200:ff:fe00:51","fe80::200:ff:fe00:2","TCP","112","[TCP Retransmission] 49153  >  8080 [SYN] Seq=0 Win=32768 Len=0 WS=4 TSval=29000 TSecr=0"
"821","29.001798","fe80::200:ff:fe00:43","fe80::200:ff:fe00:51","ICMPv6","160","Destination Unreachable (no route to destination)"
"907","40.998874","fe80::200:ff:fe00:51","fe80::200:ff:fe00:2","TCP","112","[TCP Retransmission] 49153  >  8080 [SYN] Seq=0 Win=32768 Len=0 WS=4 TSval=41000 TSecr=0"
"909","41.001798","fe80::200:ff:fe00:43","fe80::200:ff:fe00:51","ICMPv6","160","Destination Unreachable (no route to destination)"
"1151","65.002560","fe80::200:ff:fe00:51","fe80::200:ff:fe00:2","TCP","112","[TCP Retransmission] 49153  >  8080 [SYN] Seq=0 Win=32768 Len=0 WS=4 TSval=65000 TSecr=0"
"1155","65.005905","fe80::200:ff:fe00:51","fe80::200:ff:fe00:2","TCP","108","49153  >  8080 [ACK] Seq=1 Ack=1 Win=131072 Len=0 TSval=65006 TSecr=65004"
"1157","65.007566","fe80::200:ff:fe00:51","fe80::200:ff:fe00:2","TCP","644","49153  >  8080 [ACK] Seq=1 Ack=1 Win=131072 Len=536 TSval=65006 TSecr=65004"
"1161","65.014895","fe80::200:ff:fe00:51","fe80::200:ff:fe00:2","TCP","644","49153  >  8080 [ACK] Seq=537 Ack=1 Win=131072 Len=536 TSval=65015 TSecr=65014"
"1163","65.020664","fe80::200:ff:fe00:51","fe80::200:ff:fe00:2","TCP","644","49153  >  8080 [ACK] Seq=1073 Ack=1 Win=131072 Len=536 TSval=65015 TSecr=65014"
"1167","65.028293","fe80::200:ff:fe00:51","fe80::200:ff:fe00:2","TCP","644","49153  >  8080 [ACK] Seq=1609 Ack=1 Win=131072 Len=536 TSval=65028 TSecr=65027"
"1169","65.034622","fe80::200:ff:fe00:51","fe80::200:ff:fe00:2","TCP","644","49153  >  8080 [ACK] Seq=2145 Ack=1 Win=131072 Len=536 TSval=65028 TSecr=65027"
"1173","65.042111","fe80::200:ff:fe00:51","fe80::200:ff:fe00:2","TCP","644","49153  >  8080 [ACK] Seq=2681 Ack=1 Win=131072 Len=536 TSval=65028 TSecr=65027"
"1175","65.047900","fe80::200:ff:fe00:51","fe80::200:ff:fe00:2","TCP","644","49153  >  8080 [ACK] Seq=3217 Ack=1 Win=131072 Len=536 TSval=65042 TSecr=65041"
"1179","65.055189","fe80::200:ff:fe00:51","fe80::200:ff:fe00:2","TCP","644","49153  >  8080 [ACK] Seq=3753 Ack=1 Win=131072 Len=536 TSval=65042 TSecr=65041"
"1181","65.061378","fe80::200:ff:fe00:51","fe80::200:ff:fe00:2","TCP","644","49153  >  8080 [ACK] Seq=4289 Ack=1 Win=131072 Len=536 TSval=65042 TSecr=65041"
"1185","65.066511","fe80::200:ff:fe00:51","fe80::200:ff:fe00:2","TCP","644","49153  >  8080 [ACK] Seq=4825 Ack=1 Win=131072 Len=536 TSval=65055 TSecr=65054"
"1186","65.069929","fe80::200:ff:fe00:51","fe80::200:ff:fe00:2","TCP","644","[TCP Retransmission] 49153  >  8080 [ACK] Seq=4825 Ack=1 Win=131072 Len=536 TSval=65055 TSecr=65054"
"1187","65.074847","fe80::200:ff:fe00:51","fe80::200:ff:fe00:2","TCP","644","[TCP Retransmission] 49153  >  8080 [ACK] Seq=4825 Ack=1 Win=131072 Len=536 TSval=65055 TSecr=65054"
"1189","65.081176","fe80::200:ff:fe00:51","fe80::200:ff:fe00:2","TCP","644","49153  >  8080 [ACK] Seq=5361 Ack=1 Win=131072 Len=536 TSval=65055 TSecr=65054"
"1193","65.088865","fe80::200:ff:fe00:51","fe80::200:ff:fe00:2","TCP","644","49153  >  8080 [ACK] Seq=5897 Ack=1 Win=131072 Len=536 TSval=65055 TSecr=65054"
"1195","65.094894","fe80::200:ff:fe00:51","fe80::200:ff:fe00:2","TCP","644","49153  >  8080 [ACK] Seq=6433 Ack=1 Win=131072 Len=536 TSval=65066 TSecr=65065"
"1199","65.102263","fe80::200:ff:fe00:51","fe80::200:ff:fe00:2","TCP","644","49153  >  8080 [ACK] Seq=6969 Ack=1 Win=131072 Len=536 TSval=65066 TSecr=65065"
"1201","65.108392","fe80::200:ff:fe00:51","fe80::200:ff:fe00:2","TCP","644","49153  >  8080 [ACK] Seq=7505 Ack=1 Win=131072 Len=536 TSval=65066 TSecr=65065"
"1205","65.115821","fe80::200:ff:fe00:51","fe80::200:ff:fe00:2","TCP","644","49153  >  8080 [ACK] Seq=8041 Ack=1 Win=131072 Len=536 TSval=65089 TSecr=65087"
"1207","65.121670","fe80::200:ff:fe00:51","fe80::200:ff:fe00:2","TCP","644","49153  >  8080 [ACK] Seq=8577 Ack=1 Win=131072 Len=536 TSval=65089 TSecr=65087"
"1211","65.128627","fe80::200:ff:fe00:51","fe80::200:ff:fe00:2","TCP","644","49153  >  8080 [ACK] Seq=9113 Ack=1 Win=131072 Len=536 TSval=65089 TSecr=65087"
"1213","65.134336","fe80::200:ff:fe00:51","fe80::200:ff:fe00:2","TCP","644","49153  >  8080 [ACK] Seq=9649 Ack=1 Win=131072 Len=536 TSval=65102 TSecr=65101"
"1215","65.141253","fe80::200:ff:fe00:51","fe80::200:ff:fe00:2","TCP","644","49153  >  8080 [ACK] Seq=10185 Ack=1 Win=131072 Len=536 TSval=65102 TSecr=65101"
"1216","65.146594","fe80::200:ff:fe00:51","fe80::200:ff:fe00:2","TCP","644","[TCP Retransmission] 49153  >  8080 [ACK] Seq=10185 Ack=1 Win=131072 Len=536 TSval=65102 TSecr=65101"
"1218","65.152723","fe80::200:ff:fe00:51","fe80::200:ff:fe00:2","TCP","644","49153  >  8080 [ACK] Seq=10721 Ack=1 Win=131072 Len=536 TSval=65102 TSecr=65101"
"1220","65.158912","fe80::200:ff:fe00:51","fe80::200:ff:fe00:2","TCP","644","49153  >  8080 [ACK] Seq=11257 Ack=1 Win=131072 Len=536 TSval=65116 TSecr=65114"
"1222","65.164861","fe80::200:ff:fe00:51","fe80::200:ff:fe00:2","TCP","644","49153  >  8080 [ACK] Seq=11793 Ack=1 Win=131072 Len=536 TSval=65116 TSecr=65114"
"1226","65.172570","fe80::200:ff:fe00:51","fe80::200:ff:fe00:2","TCP","644","49153  >  8080 [ACK] Seq=12329 Ack=1 Win=131072 Len=536 TSval=65116 TSecr=65114"
"1230","65.180319","fe80::200:ff:fe00:51","fe80::200:ff:fe00:2","TCP","644","49153  >  8080 [ACK] Seq=12865 Ack=1 Win=131072 Len=536 TSval=65129 TSecr=65128"
"1232","65.186368","fe80::200:ff:fe00:51","fe80::200:ff:fe00:2","TCP","644","49153  >  8080 [ACK] Seq=13401 Ack=1 Win=131072 Len=536 TSval=65129 TSecr=65128"
"1236","65.193577","fe80::200:ff:fe00:51","fe80::200:ff:fe00:2","TCP","644","49153  >  8080 [ACK] Seq=13937 Ack=1 Win=131072 Len=536 TSval=65129 TSecr=65128"
"1239","65.201752","fe80::200:ff:fe00:51","fe80::200:ff:fe00:2","TCP","644","[TCP Retransmission] 49153  >  8080 [ACK] Seq=13937 Ack=1 Win=131072 Len=536 TSval=65129 TSecr=65128"
"1243","65.208941","fe80::200:ff:fe00:51","fe80::200:ff:fe00:2","TCP","644","49153  >  8080 [ACK] Seq=14473 Ack=1 Win=131072 Len=536 TSval=65173 TSecr=65140"
"1245","65.214670","fe80::200:ff:fe00:51","fe80::200:ff:fe00:2","TCP","644","49153  >  8080 [ACK] Seq=15009 Ack=1 Win=131072 Len=536 TSval=65173 TSecr=65140"
"1249","65.222419","fe80::200:ff:fe00:51","fe80::200:ff:fe00:2","TCP","644","49153  >  8080 [ACK] Seq=15545 Ack=1 Win=131072 Len=536 TSval=65173 TSecr=65140"
"1251","65.228608","fe80::200:ff:fe00:51","fe80::200:ff:fe00:2","TCP","644","49153  >  8080 [ACK] Seq=16081 Ack=1 Win=131072 Len=536 TSval=65180 TSecr=65159"
"1255","65.236356","fe80::200:ff:fe00:51","fe80::200:ff:fe00:2","TCP","644","49153  >  8080 [ACK] Seq=16617 Ack=1 Win=131072 Len=536 TSval=65180 TSecr=65159"
"1257","65.242425","fe80::200:ff:fe00:51","fe80::200:ff:fe00:2","TCP","644","49153  >  8080 [ACK] Seq=17153 Ack=1 Win=131072 Len=536 TSval=65180 TSecr=65159"
"1261","65.249594","fe80::200:ff:fe00:51","fe80::200:ff:fe00:2","TCP","644","49153  >  8080 [ACK] Seq=17689 Ack=1 Win=131072 Len=536 TSval=65194 TSecr=65171"
"1262","65.253832","fe80::200:ff:fe00:51","fe80::200:ff:fe00:2","TCP","644","[TCP Retransmission] 49153  >  8080 [ACK] Seq=17689 Ack=1 Win=131072 Len=536 TSval=65194 TSecr=65171"
"1264","65.260161","fe80::200:ff:fe00:51","fe80::200:ff:fe00:2","TCP","644","49153  >  8080 [ACK] Seq=18225 Ack=1 Win=131072 Len=536 TSval=65194 TSecr=65171"
"1268","65.267410","fe80::200:ff:fe00:51","fe80::200:ff:fe00:2","TCP","644","49153  >  8080 [ACK] Seq=18761 Ack=1 Win=131072 Len=536 TSval=65194 TSecr=65171"
"1270","65.273139","fe80::200:ff:fe00:51","fe80::200:ff:fe00:2","TCP","644","49153  >  8080 [ACK] Seq=19297 Ack=1 Win=131072 Len=536 TSval=65201 TSecr=65186"
"1274","65.280708","fe80::200:ff:fe00:51","fe80::200:ff:fe00:2","TCP","644","49153  >  8080 [ACK] Seq=19833 Ack=1 Win=131072 Len=536 TSval=65201 TSecr=65186"
"1276","65.286957","fe80::200:ff:fe00:51","fe80::200:ff:fe00:2","TCP","644","49153  >  8080 [ACK] Seq=20369 Ack=1 Win=131072 Len=536 TSval=65201 TSecr=65186"
"1280","65.294286","fe80::200:ff:fe00:51","fe80::200:ff:fe00:2","TCP","644","49153  >  8080 [ACK] Seq=20905 Ack=1 Win=131072 Len=536 TSval=65209 TSecr=65208"
"1282","65.300435","fe80::200:ff:fe00:51","fe80::200:ff:fe00:2","TCP","644","49153  >  8080 [ACK] Seq=21441 Ack=1 Win=131072 Len=536 TSval=65209 TSecr=65208"
"1286","65.307864","fe80::200:ff:fe00:51","fe80::200:ff:fe00:2","TCP","644","49153  >  8080 [ACK] Seq=21977 Ack=1 Win=131072 Len=536 TSval=65209 TSecr=65208"
"1288","65.314173","fe80::200:ff:fe00:51","fe80::200:ff:fe00:2","TCP","644","49153  >  8080 [ACK] Seq=22513 Ack=1 Win=131072 Len=536 TSval=65223 TSecr=65221"
"1292","65.321582","fe80::200:ff:fe00:51","fe80::200:ff:fe00:2","TCP","644","49153  >  8080 [ACK] Seq=23049 Ack=1 Win=131072 Len=536 TSval=65223 TSecr=65221"
"1293","65.325840","fe80::200:ff:fe00:51","fe80::200:ff:fe00:2","TCP","644","[TCP Retransmission] 49153  >  8080 [ACK] Seq=23049 Ack=1 Win=131072 Len=536 TSval=65223 TSecr=65221"
"1295","65.331769","fe80::200:ff:fe00:51","fe80::200:ff:fe00:2","TCP","644","49153  >  8080 [ACK] Seq=23585 Ack=1 Win=131072 Len=536 TSval=65223 TSecr=65221"
"1299","65.338706","fe80::200:ff:fe00:51","fe80::200:ff:fe00:2","TCP","644","49153  >  8080 [ACK] Seq=24121 Ack=1 Win=131072 Len=536 TSval=65236 TSecr=65235"
"1301","65.344675","fe80::200:ff:fe00:51","fe80::200:ff:fe00:2","TCP","644","49153  >  8080 [ACK] Seq=24657 Ack=1 Win=131072 Len=536 TSval=65236 TSecr=65235"
"1303","65.350384","fe80::200:ff:fe00:51","fe80::200:ff:fe00:2","TCP","644","49153  >  8080 [ACK] Seq=25193 Ack=1 Win=131072 Len=536 TSval=65236 TSecr=65235"
"1306","65.357687","fe80::200:ff:fe00:51","fe80::200:ff:fe00:2","TCP","644","[TCP Retransmission] 49153  >  8080 [ACK] Seq=25193 Ack=1 Win=131072 Len=536 TSval=65236 TSecr=65235"
"1308","65.363916","fe80::200:ff:fe00:51","fe80::200:ff:fe00:2","TCP","644","49153  >  8080 [ACK] Seq=25729 Ack=1 Win=131072 Len=536 TSval=65250 TSecr=65248"
"1310","65.371033","fe80::200:ff:fe00:51","fe80::200:ff:fe00:2","TCP","644","49153  >  8080 [ACK] Seq=26265 Ack=1 Win=131072 Len=536 TSval=65250 TSecr=65248"
"1314","65.377810","fe80::200:ff:fe00:51","fe80::200:ff:fe00:2","TCP","644","49153  >  8080 [ACK] Seq=26801 Ack=1 Win=131072 Len=536 TSval=65250 TSecr=65248"
"1318","65.385087","fe80::200:ff:fe00:51","fe80::200:ff:fe00:2","TCP","644","49153  >  8080 [ACK] Seq=27337 Ack=1 Win=131072 Len=536 TSval=65268 TSecr=65266"
"1320","65.391076","fe80::200:ff:fe00:51","fe80::200:ff:fe00:2","TCP","644","49153  >  8080 [ACK] Seq=27873 Ack=1 Win=131072 Len=536 TSval=65268 TSecr=65266"
"1324","65.399267","fe80::200:ff:fe00:51","fe80::200:ff:fe00:2","TCP","644","49153  >  8080 [ACK] Seq=28409 Ack=1 Win=131072 Len=536 TSval=65268 TSecr=65266"
"1326","65.405396","fe80::200:ff:fe00:51","fe80::200:ff:fe00:2","TCP","644","49153  >  8080 [ACK] Seq=28945 Ack=1 Win=131072 Len=536 TSval=65281 TSecr=65279"
"1330","65.412513","fe80::200:ff:fe00:51","fe80::200:ff:fe00:2","TCP","644","49153  >  8080 [ACK] Seq=29481 Ack=1 Win=131072 Len=536 TSval=65281 TSecr=65279"
"1332","65.418342","fe80::200:ff:fe00:51","fe80::200:ff:fe00:2","TCP","644","49153  >  8080 [ACK] Seq=30017 Ack=1 Win=131072 Len=536 TSval=65281 TSecr=65279"
"1336","65.425399","fe80::200:ff:fe00:51","fe80::200:ff:fe00:2","TCP","644","49153  >  8080 [ACK] Seq=30553 Ack=1 Win=131072 Len=536 TSval=65294 TSecr=65293"
"1338","65.428592","fe80::200:ff:fe00:51","fe80::200:ff:fe00:2","TCP","644","49153  >  8080 [ACK] Seq=31089 Ack=1 Win=131072 Len=536 TSval=65294 TSecr=65293"
"1342","65.432753","fe80::200:ff:fe00:51","fe80::200:ff:fe00:2","TCP","644","49153  >  8080 [ACK] Seq=31625 Ack=1 Win=131072 Len=536 TSval=65294 TSecr=65293"
"1343","65.436111","fe80::200:ff:fe00:51","fe80::200:ff:fe00:2","TCP","644","[TCP Retransmission] 49153  >  8080 [ACK] Seq=31625 Ack=1 Win=131072 Len=536 TSval=65294 TSecr=65293"
"1345","65.439824","fe80::200:ff:fe00:51","fe80::200:ff:fe00:2","TCP","644","49153  >  8080 [ACK] Seq=32161 Ack=1 Win=131072 Len=536 TSval=65308 TSecr=65306"
"1346","65.443082","fe80::200:ff:fe00:51","fe80::200:ff:fe00:2","TCP","644","[TCP Retransmission] 49153  >  8080 [ACK] Seq=32161 Ack=1 Win=131072 Len=536 TSval=65308 TSecr=65306"
"1348","65.446215","fe80::200:ff:fe00:51","fe80::200:ff:fe00:2","TCP","644","49153  >  8080 [ACK] Seq=32697 Ack=1 Win=131072 Len=536 TSval=65308 TSecr=65306"
"1351","65.451421","fe80::200:ff:fe00:51","fe80::200:ff:fe00:2","TCP","644","[TCP Retransmission] 49153  >  8080 [ACK] Seq=32697 Ack=1 Win=131072 Len=536 TSval=65308 TSecr=65306"
"1353","65.455134","fe80::200:ff:fe00:51","fe80::200:ff:fe00:2","TCP","644","49153  >  8080 [ACK] Seq=33233 Ack=1 Win=131072 Len=536 TSval=65308 TSecr=65306"
"1354","65.459012","fe80::200:ff:fe00:51","fe80::200:ff:fe00:2","TCP","644","[TCP Retransmission] 49153  >  8080 [ACK] Seq=33233 Ack=1 Win=131072 Len=536 TSval=65308 TSecr=65306"
"1355","65.464450","fe80::200:ff:fe00:51","fe80::200:ff:fe00:2","TCP","644","[TCP Retransmission] 49153  >  8080 [ACK] Seq=33233 Ack=1 Win=131072 Len=536 TSval=65308 TSecr=65306"
"1357","65.471327","fe80::200:ff:fe00:51","fe80::200:ff:fe00:2","TCP","644","49153  >  8080 [ACK] Seq=33769 Ack=1 Win=131072 Len=536 TSval=65322 TSecr=65320"
"1359","65.477236","fe80::200:ff:fe00:51","fe80::200:ff:fe00:2","TCP","644","49153  >  8080 [ACK] Seq=34305 Ack=1 Win=131072 Len=536 TSval=65322 TSecr=65320"
"1361","65.482945","fe80::200:ff:fe00:51","fe80::200:ff:fe00:2","TCP","644","49153  >  8080 [ACK] Seq=34841 Ack=1 Win=131072 Len=536 TSval=65322 TSecr=65320"
"1363","65.488954","fe80::200:ff:fe00:51","fe80::200:ff:fe00:2","TCP","644","49153  >  8080 [ACK] Seq=35377 Ack=1 Win=131072 Len=536 TSval=65339 TSecr=65338"
"1365","65.494763","fe80::200:ff:fe00:51","fe80::200:ff:fe00:2","TCP","644","49153  >  8080 [ACK] Seq=35913 Ack=1 Win=131072 Len=536 TSval=65339 TSecr=65338"
"1367","65.500592","fe80::200:ff:fe00:51","fe80::200:ff:fe00:2","TCP","644","49153  >  8080 [ACK] Seq=36449 Ack=1 Win=131072 Len=536 TSval=65339 TSecr=65338"
"1369","65.506321","fe80::200:ff:fe00:51","fe80::200:ff:fe00:2","TCP","644","49153  >  8080 [ACK] Seq=36985 Ack=1 Win=131072 Len=536 TSval=65358 TSecr=65351"
"1371","65.512110","fe80::200:ff:fe00:51","fe80::200:ff:fe00:2","TCP","644","49153  >  8080 [ACK] Seq=37521 Ack=1 Win=131072 Len=536 TSval=65358 TSecr=65351"
"1375","65.519287","fe80::200:ff:fe00:51","fe80::200:ff:fe00:2","TCP","644","49153  >  8080 [ACK] Seq=38057 Ack=1 Win=131072 Len=536 TSval=65358 TSecr=65351"
"1377","65.525930","fe80::200:ff:fe00:51","fe80::200:ff:fe00:2","TCP","644","49153  >  8080 [ACK] Seq=38593 Ack=1 Win=131072 Len=536 TSval=65378 TSecr=65370"
"1380","65.531031","fe80::200:ff:fe00:51","fe80::200:ff:fe00:2","TCP","644","[TCP Retransmission] 49153  >  8080 [ACK] Seq=38593 Ack=1 Win=131072 Len=536 TSval=65378 TSecr=65370"
"1382","65.537020","fe80::200:ff:fe00:51","fe80::200:ff:fe00:2","TCP","644","49153  >  8080 [ACK] Seq=39129 Ack=1 Win=131072 Len=536 TSval=65378 TSecr=65370"
"1386","65.544237","fe80::200:ff:fe00:51","fe80::200:ff:fe00:2","TCP","644","49153  >  8080 [ACK] Seq=39665 Ack=1 Win=131072 Len=536 TSval=65378 TSecr=65370"
"1390","65.552188","fe80::200:ff:fe00:51","fe80::200:ff:fe00:2","TCP","644","49153  >  8080 [ACK] Seq=40201 Ack=1 Win=131072 Len=536 TSval=65385 TSecr=65384"
"1392","65.558237","fe80::200:ff:fe00:51","fe80::200:ff:fe00:2","TCP","644","49153  >  8080 [ACK] Seq=40737 Ack=1 Win=131072 Len=536 TSval=65385 TSecr=65384"
"1398","65.567437","fe80::200:ff:fe00:51","fe80::200:ff:fe00:2","TCP","644","49153  >  8080 [ACK] Seq=41273 Ack=1 Win=131072 Len=536 TSval=65385 TSecr=65384"
"1400","65.573386","fe80::200:ff:fe00:51","fe80::200:ff:fe00:2","TCP","644","49153  >  8080 [ACK] Seq=41809 Ack=1 Win=131072 Len=536 TSval=65399 TSecr=65397"
"1404","65.580443","fe80::200:ff:fe00:51","fe80::200:ff:fe00:2","TCP","644","49153  >  8080 [ACK] Seq=42345 Ack=1 Win=131072 Len=536 TSval=65399 TSecr=65397"
"1408","65.587500","fe80::200:ff:fe00:51","fe80::200:ff:fe00:2","TCP","644","49153  >  8080 [ACK] Seq=42881 Ack=1 Win=131072 Len=536 TSval=65399 TSecr=65397"
"1412","65.594357","fe80::200:ff:fe00:51","fe80::200:ff:fe00:2","TCP","644","49153  >  8080 [ACK] Seq=43417 Ack=1 Win=131072 Len=536 TSval=65412 TSecr=65411"
"1414","65.600306","fe80::200:ff:fe00:51","fe80::200:ff:fe00:2","TCP","644","49153  >  8080 [ACK] Seq=43953 Ack=1 Win=131072 Len=536 TSval=65412 TSecr=65411"
"1415","65.603604","fe80::200:ff:fe00:51","fe80::200:ff:fe00:2","TCP","644","[TCP Retransmission] 49153  >  8080 [ACK] Seq=43953 Ack=1 Win=131072 Len=536 TSval=65412 TSecr=65411"
"1419","65.610641","fe80::200:ff:fe00:51","fe80::200:ff:fe00:2","TCP","644","49153  >  8080 [ACK] Seq=44489 Ack=1 Win=131072 Len=536 TSval=65412 TSecr=65411"
"1423","65.617658","fe80::200:ff:fe00:51","fe80::200:ff:fe00:2","TCP","644","49153  >  8080 [ACK] Seq=45025 Ack=1 Win=131072 Len=536 TSval=65425 TSecr=65424"
"1427","65.624875","fe80::200:ff:fe00:51","fe80::200:ff:fe00:2","TCP","644","49153  >  8080 [ACK] Seq=45561 Ack=1 Win=131072 Len=536 TSval=65425 TSecr=65424"
"1429","65.631064","fe80::200:ff:fe00:51","fe80::200:ff:fe00:2","TCP","644","49153  >  8080 [ACK] Seq=46097 Ack=1 Win=131072 Len=536 TSval=65425 TSecr=65424"
"1433","65.639355","fe80::200:ff:fe00:51","fe80::200:ff:fe00:2","TCP","644","49153  >  8080 [ACK] Seq=46633 Ack=1 Win=131072 Len=536 TSval=65433 TSecr=65432"
"1435","65.645644","fe80::200:ff:fe00:51","fe80::200:ff:fe00:2","TCP","644","49153  >  8080 [ACK] Seq=47169 Ack=1 Win=131072 Len=536 TSval=65433 TSecr=65432"
"1437","65.652186","fe80::200:ff:fe00:51","fe80::200:ff:fe00:2","TCP","644","49153  >  8080 [ACK] Seq=47705 Ack=1 Win=131072 Len=536 TSval=65433 TSecr=65432"
"1439","65.658275","fe80::200:ff:fe00:51","fe80::200:ff:fe00:2","TCP","644","49153  >  8080 [ACK] Seq=48241 Ack=1 Win=131072 Len=536 TSval=65451 TSecr=65446"
"1441","65.663984","fe80::200:ff:fe00:51","fe80::200:ff:fe00:2","TCP","644","49153  >  8080 [ACK] Seq=48777 Ack=1 Win=131072 Len=536 TSval=65451 TSecr=65446"
"1445","65.671281","fe80::200:ff:fe00:51","fe80::200:ff:fe00:2","TCP","644","49153  >  8080 [ACK] Seq=49313 Ack=1 Win=131072 Len=536 TSval=65451 TSecr=65446"
"1448","65.676702","fe80::200:ff:fe00:51","fe80::200:ff:fe00:2","TCP","644","[TCP Retransmission] 49153  >  8080 [ACK] Seq=49313 Ack=1 Win=131072 Len=536 TSval=65451 TSecr=65446"
"1452","65.683999","fe80::200:ff:fe00:51","fe80::200:ff:fe00:2","TCP","644","49153  >  8080 [ACK] Seq=49849 Ack=1 Win=131072 Len=536 TSval=65519 TSecr=65470"
"1454","65.689928","fe80::200:ff:fe00:51","fe80::200:ff:fe00:2","TCP","644","49153  >  8080 [ACK] Seq=50385 Ack=1 Win=131072 Len=536 TSval=65519 TSecr=65470"
"1458","65.696885","fe80::200:ff:fe00:51","fe80::200:ff:fe00:2","TCP","644","49153  >  8080 [ACK] Seq=50921 Ack=1 Win=131072 Len=536 TSval=65519 TSecr=65470"
"1460","65.702814","fe80::200:ff:fe00:51","fe80::200:ff:fe00:2","TCP","644","49153  >  8080 [ACK] Seq=51457 Ack=1 Win=131072 Len=536 TSval=65531 TSecr=65483"
"1464","65.709791","fe80::200:ff:fe00:51","fe80::200:ff:fe00:2","TCP","644","49153  >  8080 [ACK] Seq=51993 Ack=1 Win=131072 Len=536 TSval=65531 TSecr=65483"
"1466","65.715620","fe80::200:ff:fe00:51","fe80::200:ff:fe00:2","TCP","644","49153  >  8080 [ACK] Seq=52529 Ack=1 Win=131072 Len=536 TSval=65531 TSecr=65483"
"1470","65.722677","fe80::200:ff:fe00:51","fe80::200:ff:fe00:2","TCP","644","49153  >  8080 [ACK] Seq=53065 Ack=1 Win=131072 Len=536 TSval=65544 TSecr=65495"
"1472","65.728966","fe80::200:ff:fe00:51","fe80::200:ff:fe00:2","TCP","644","49153  >  8080 [ACK] Seq=53601 Ack=1 Win=131072 Len=536 TSval=65544 TSecr=65495"
"1476","65.735703","fe80::200:ff:fe00:51","fe80::200:ff:fe00:2","TCP","644","49153  >  8080 [ACK] Seq=54137 Ack=1 Win=131072 Len=536 TSval=65544 TSecr=65495"
"1478","65.741532","fe80::200:ff:fe00:51","fe80::200:ff:fe00:2","TCP","644","49153  >  8080 [ACK] Seq=54673 Ack=1 Win=131072 Len=536 TSval=65552 TSecr=65507"
"1482","65.745973","fe80::200:ff:fe00:51","fe80::200:ff:fe00:2","TCP","644","49153  >  8080 [ACK] Seq=55209 Ack=1 Win=131072 Len=536 TSval=65552 TSecr=65507"
"1483","65.750191","fe80::200:ff:fe00:51","fe80::200:ff:fe00:2","TCP","644","[TCP Retransmission] 49153  >  8080 [ACK] Seq=55209 Ack=1 Win=131072 Len=536 TSval=65552 TSecr=65507"
"1484","65.754889","fe80::200:ff:fe00:51","fe80::200:ff:fe00:2","TCP","644","[TCP Retransmission] 49153  >  8080 [ACK] Seq=55209 Ack=1 Win=131072 Len=536 TSval=65552 TSecr=65507"
"1486","65.761038","fe80::200:ff:fe00:51","fe80::200:ff:fe00:2","TCP","644","49153  >  8080 [ACK] Seq=55745 Ack=1 Win=131072 Len=536 TSval=65552 TSecr=65507"
"1490","65.768095","fe80::200:ff:fe00:51","fe80::200:ff:fe00:2","TCP","644","49153  >  8080 [ACK] Seq=56281 Ack=1 Win=131072 Len=536 TSval=65565 TSecr=65518"
"1492","65.774064","fe80::200:ff:fe00:51","fe80::200:ff:fe00:2","TCP","644","49153  >  8080 [ACK] Seq=56817 Ack=1 Win=131072 Len=536 TSval=65565 TSecr=65518"
"1494","65.780941","fe80::200:ff:fe00:51","fe80::200:ff:fe00:2","TCP","644","49153  >  8080 [ACK] Seq=57353 Ack=1 Win=131072 Len=536 TSval=65565 TSecr=65518"
"1496","65.786890","fe80::200:ff:fe00:51","fe80::200:ff:fe00:2","TCP","644","49153  >  8080 [ACK] Seq=57889 Ack=1 Win=131072 Len=536 TSval=65568 TSecr=65537"
"1498","65.792859","fe80::200:ff:fe00:51","fe80::200:ff:fe00:2","TCP","644","49153  >  8080 [ACK] Seq=58425 Ack=1 Win=131072 Len=536 TSval=65568 TSecr=65537"
"1500","65.799008","fe80::200:ff:fe00:51","fe80::200:ff:fe00:2","TCP","644","49153  >  8080 [ACK] Seq=58961 Ack=1 Win=131072 Len=536 TSval=65568 TSecr=65537"
"1504","65.806185","fe80::200:ff:fe00:51","fe80::200:ff:fe00:2","TCP","644","49153  >  8080 [ACK] Seq=59497 Ack=1 Win=131072 Len=536 TSval=65580 TSecr=65550"
"1508","65.812922","fe80::200:ff:fe00:51","fe80::200:ff:fe00:2","TCP","644","49153  >  8080 [ACK] Seq=60033 Ack=1 Win=131072 Len=536 TSval=65580 TSecr=65550"
"1510","65.818671","fe80::200:ff:fe00:51","fe80::200:ff:fe00:2","TCP","644","49153  >  8080 [ACK] Seq=60569 Ack=1 Win=131072 Len=536 TSval=65580 TSecr=65550"
"1512","65.823372","fe80::200:ff:fe00:51","fe80::200:ff:fe00:2","TCP","644","49153  >  8080 [ACK] Seq=61105 Ack=1 Win=131072 Len=536 TSval=65588 TSecr=65564"
"1513","65.826570","fe80::200:ff:fe00:51","fe80::200:ff:fe00:2","TCP","644","[TCP Retransmission] 49153  >  8080 [ACK] Seq=61105 Ack=1 Win=131072 Len=536 TSval=65588 TSecr=65564"
"1514","65.829748","fe80::200:ff:fe00:51","fe80::200:ff:fe00:2","TCP","644","[TCP Retransmission] 49153  >  8080 [ACK] Seq=61105 Ack=1 Win=131072 Len=536 TSval=65588 TSecr=65564"
"1516","65.835537","fe80::200:ff:fe00:51","fe80::200:ff:fe00:2","TCP","644","49153  >  8080 [ACK] Seq=61641 Ack=1 Win=131072 Len=536 TSval=65588 TSecr=65564"
"1518","65.841265","fe80::200:ff:fe00:51","fe80::200:ff:fe00:2","TCP","644","49153  >  8080 [ACK] Seq=62177 Ack=1 Win=131072 Len=536 TSval=65588 TSecr=65564"
"1524","65.849111","fe80::200:ff:fe00:51","fe80::200:ff:fe00:2","TCP","644","49153  >  8080 [ACK] Seq=62713 Ack=1 Win=131072 Len=536 TSval=65595 TSecr=65579"
"1526","65.855914","fe80::200:ff:fe00:51","fe80::200:ff:fe00:2","TCP","644","49153  >  8080 [ACK] Seq=63249 Ack=1 Win=131072 Len=536 TSval=65595 TSecr=65579"
"1528","65.862223","fe80::200:ff:fe00:51","fe80::200:ff:fe00:2","TCP","644","49153  >  8080 [ACK] Seq=63785 Ack=1 Win=131072 Len=536 TSval=65595 TSecr=65579"
"1534","65.870189","fe80::200:ff:fe00:51","fe80::200:ff:fe00:2","TCP","644","49153  >  8080 [ACK] Seq=64321 Ack=1 Win=131072 Len=536 TSval=65611 TSecr=65593"
"1536","65.876218","fe80::200:ff:fe00:51","fe80::200:ff:fe00:2","TCP","644","49153  >  8080 [ACK] Seq=64857 Ack=1 Win=131072 Len=536 TSval=65611 TSecr=65593"
"1538","65.882027","fe80::200:ff:fe00:51","fe80::200:ff:fe00:2","TCP","644","49153  >  8080 [ACK] Seq=65393 Ack=1 Win=131072 Len=536 TSval=65611 TSecr=65593"
"1542","65.888764","fe80::200:ff:fe00:51","fe80::200:ff:fe00:2","TCP","644","49153  >  8080 [ACK] Seq=65929 Ack=1 Win=131072 Len=536 TSval=65618 TSecr=65610"
"1546","65.896061","fe80::200:ff:fe00:51","fe80::200:ff:fe00:2","TCP","644","49153  >  8080 [ACK] Seq=66465 Ack=1 Win=131072 Len=536 TSval=65618 TSecr=65610"
"1549","65.901382","fe80::200:ff:fe00:51","fe80::200:ff:fe00:2","TCP","644","[TCP Retransmission] 49153  >  8080 [ACK] Seq=66465 Ack=1 Win=131072 Len=536 TSval=65618 TSecr=65610"
"1553","65.908419","fe80::200:ff:fe00:51","fe80::200:ff:fe00:2","TCP","644","49153  >  8080 [ACK] Seq=67001 Ack=1 Win=131072 Len=536 TSval=65618 TSecr=65610"
"1555","65.914328","fe80::200:ff:fe00:51","fe80::200:ff:fe00:2","TCP","644","49153  >  8080 [ACK] Seq=67537 Ack=1 Win=131072 Len=536 TSval=65625 TSecr=65624"
"1559","65.921345","fe80::200:ff:fe00:51","fe80::200:ff:fe00:2","TCP","644","49153  >  8080 [ACK] Seq=68073 Ack=1 Win=131072 Len=536 TSval=65625 TSecr=65624"
"1561","65.927054","fe80::200:ff:fe00:51","fe80::200:ff:fe00:2","TCP","644","49153  >  8080 [ACK] Seq=68609 Ack=1 Win=131072 Len=536 TSval=65625 TSecr=65624"
"1563","65.932863","fe80::200:ff:fe00:51","fe80::200:ff:fe00:2","TCP","644","49153  >  8080 [ACK] Seq=69145 Ack=1 Win=131072 Len=536 TSval=65639 TSecr=65637"
"1565","65.938592","fe80::200:ff:fe00:51","fe80::200:ff:fe00:2","TCP","644","49153  >  8080 [ACK] Seq=69681 Ack=1 Win=131072 Len=536 TSval=65639 TSecr=65637"
"1571","65.946878","fe80::200:ff:fe00:51","fe80::200:ff:fe00:2","TCP","644","49153  >  8080 [ACK] Seq=70217 Ack=1 Win=131072 Len=536 TSval=65639 TSecr=65637"
"1573","65.953187","fe80::200:ff:fe00:51","fe80::200:ff:fe00:2","TCP","644","49153  >  8080 [ACK] Seq=70753 Ack=1 Win=131072 Len=536 TSval=65671 TSecr=65652"
"1577","65.959944","fe80::200:ff:fe00:51","fe80::200:ff:fe00:2","TCP","644","49153  >  8080 [ACK] Seq=71289 Ack=1 Win=131072 Len=536 TSval=65671 TSecr=65652"
"1579","65.966033","fe80::200:ff:fe00:51","fe80::200:ff:fe00:2","TCP","644","49153  >  8080 [ACK] Seq=71825 Ack=1 Win=131072 Len=536 TSval=65671 TSecr=65652"
"1580","65.969591","fe80::200:ff:fe00:51","fe80::200:ff:fe00:2","TCP","644","[TCP Retransmission] 49153  >  8080 [ACK] Seq=71825 Ack=1 Win=131072 Len=536 TSval=65671 TSecr=65652"
"1582","65.976274","fe80::200:ff:fe00:51","fe80::200:ff:fe00:2","TCP","644","49153  >  8080 [ACK] Seq=72361 Ack=1 Win=131072 Len=536 TSval=65676 TSecr=65664"
"1584","65.982223","fe80::200:ff:fe00:51","fe80::200:ff:fe00:2","TCP","644","49153  >  8080 [ACK] Seq=72897 Ack=1 Win=131072 Len=536 TSval=65676 TSecr=65664"
"1586","65.988472","fe80::200:ff:fe00:51","fe80::200:ff:fe00:2","TCP","644","49153  >  8080 [ACK] Seq=73433 Ack=1 Win=131072 Len=536 TSval=65676 TSecr=65664"
"1590","65.995448","fe80::200:ff:fe00:51","fe80::200:ff:fe00:2","TCP","644","49153  >  8080 [ACK] Seq=73969 Ack=1 Win=131072 Len=536 TSval=65684 TSecr=65683"
"1592","66.001177","fe80::200:ff:fe00:51","fe80::200:ff:fe00:2","TCP","644","49153  >  8080 [ACK] Seq=74505 Ack=1 Win=131072 Len=536 TSval=65684 TSecr=65683"
"1594","66.006906","fe80::200:ff:fe00:51","fe80::200:ff:fe00:2","TCP","644","49153  >  8080 [ACK] Seq=75041 Ack=1 Win=131072 Len=536 TSval=65684 TSecr=65683"
"1596","66.012755","fe80::200:ff:fe00:51","fe80::200:ff:fe00:2","TCP","644","49153  >  8080 [ACK] Seq=75577 Ack=1 Win=131072 Len=536 TSval=65697 TSecr=65696"
"1600","66.020052","fe80::200:ff:fe00:51","fe80::200:ff:fe00:2","TCP","644","49153  >  8080 [ACK] Seq=76113 Ack=1 Win=131072 Len=536 TSval=65697 TSecr=65696"
"1604","66.026809","fe80::200:ff:fe00:51","fe80::200:ff:fe00:2","TCP","644","49153  >  8080 [ACK] Seq=76649 Ack=1 Win=131072 Len=536 TSval=65697 TSecr=65696"
"1609","66.035573","fe80::200:ff:fe00:51","fe80::200:ff:fe00:2","TCP","644","[TCP Retransmission] 49153  >  8080 [ACK] Seq=76649 Ack=1 Win=131072 Len=536 TSval=65697 TSecr=65696"
"1613","66.042490","fe80::200:ff:fe00:51","fe80::200:ff:fe00:2","TCP","644","49153  >  8080 [ACK] Seq=77185 Ack=1 Win=131072 Len=536 TSval=65710 TSecr=65709"
"1617","66.049667","fe80::200:ff:fe00:51","fe80::200:ff:fe00:2","TCP","644","49153  >  8080 [ACK] Seq=77721 Ack=1 Win=131072 Len=536 TSval=65710 TSecr=65709"
"1619","66.055856","fe80::200:ff:fe00:51","fe80::200:ff:fe00:2","TCP","644","49153  >  8080 [ACK] Seq=78257 Ack=1 Win=131072 Len=536 TSval=65710 TSecr=65709"
"1623","66.063133","fe80::200:ff:fe00:51","fe80::200:ff:fe00:2","TCP","644","49153  >  8080 [ACK] Seq=78793 Ack=1 Win=131072 Len=536 TSval=65723 TSecr=65722"
"1625","66.069262","fe80::200:ff:fe00:51","fe80::200:ff:fe00:2","TCP","644","49153  >  8080 [ACK] Seq=79329 Ack=1 Win=131072 Len=536 TSval=65723 TSecr=65722"
"1626","66.072440","fe80::200:ff:fe00:51","fe80::200:ff:fe00:2","TCP","644","[TCP Retransmission] 49153  >  8080 [ACK] Seq=79329 Ack=1 Win=131072 Len=536 TSval=65723 TSecr=65722"
"1630","66.079256","fe80::200:ff:fe00:51","fe80::200:ff:fe00:2","TCP","644","49153  >  8080 [ACK] Seq=79865 Ack=1 Win=131072 Len=536 TSval=65723 TSecr=65722"
"1632","66.085565","fe80::200:ff:fe00:51","fe80::200:ff:fe00:2","TCP","644","49153  >  8080 [ACK] Seq=80401 Ack=1 Win=131072 Len=536 TSval=65736 TSecr=65735"
"1636","66.092662","fe80::200:ff:fe00:51","fe80::200:ff:fe00:2","TCP","644","49153  >  8080 [ACK] Seq=80937 Ack=1 Win=131072 Len=536 TSval=65736 TSecr=65735"
"1638","66.098451","fe80::200:ff:fe00:51","fe80::200:ff:fe00:2","TCP","644","49153  >  8080 [ACK] Seq=81473 Ack=1 Win=131072 Len=536 TSval=65736 TSecr=65735"
"1640","66.104160","fe80::200:ff:fe00:51","fe80::200:ff:fe00:2","TCP","644","49153  >  8080 [ACK] Seq=82009 Ack=1 Win=131072 Len=536 TSval=65746 TSecr=65745"
"1641","66.110094","fe80::200:ff:fe00:51","fe80::200:ff:fe00:2","TCP","644","[TCP Retransmission] 49153  >  8080 [ACK] Seq=82009 Ack=1 Win=131072 Len=536 TSval=65746 TSecr=65745"
"1643","66.116063","fe80::200:ff:fe00:51","fe80::200:ff:fe00:2","TCP","644","49153  >  8080 [ACK] Seq=82545 Ack=1 Win=131072 Len=536 TSval=65746 TSecr=65745"
"1646","66.124158","fe80::200:ff:fe00:51","fe80::200:ff:fe00:2","TCP","644","[TCP Retransmission] 49153  >  8080 [ACK] Seq=82545 Ack=1 Win=131072 Len=536 TSval=65746 TSecr=65745"
"1650","66.131587","fe80::200:ff:fe00:51","fe80::200:ff:fe00:2","TCP","644","49153  >  8080 [ACK] Seq=83081 Ack=1 Win=131072 Len=536 TSval=65746 TSecr=65745"
"1652","66.137316","fe80::200:ff:fe00:51","fe80::200:ff:fe00:2","TCP","644","49153  >  8080 [ACK] Seq=83617 Ack=1 Win=131072 Len=536 TSval=65768 TSecr=65767"
"1656","66.145005","fe80::200:ff:fe00:51","fe80::200:ff:fe00:2","TCP","644","49153  >  8080 [ACK] Seq=84153 Ack=1 Win=131072 Len=536 TSval=65768 TSecr=65767"
"1658","66.151174","fe80::200:ff:fe00:51","fe80::200:ff:fe00:2","TCP","644","49153  >  8080 [ACK] Seq=84689 Ack=1 Win=131072 Len=536 TSval=65768 TSecr=65767"
"1662","66.158743","fe80::200:ff:fe00:51","fe80::200:ff:fe00:2","TCP","644","49153  >  8080 [ACK] Seq=85225 Ack=1 Win=131072 Len=536 TSval=65806 TSecr=65780"
"1664","66.164952","fe80::200:ff:fe00:51","fe80::200:ff:fe00:2","TCP","644","49153  >  8080 [ACK] Seq=85761 Ack=1 Win=131072 Len=536 TSval=65806 TSecr=65780"
"1668","66.172621","fe80::200:ff:fe00:51","fe80::200:ff:fe00:2","TCP","644","49153  >  8080 [ACK] Seq=86297 Ack=1 Win=131072 Len=536 TSval=65806 TSecr=65780"
"1670","66.176134","fe80::200:ff:fe00:51","fe80::200:ff:fe00:2","TCP","644","49153  >  8080 [ACK] Seq=86833 Ack=1 Win=131072 Len=536 TSval=65813 TSecr=65793"
"1674","66.181167","fe80::200:ff:fe00:51","fe80::200:ff:fe00:2","TCP","644","49153  >  8080 [ACK] Seq=87369 Ack=1 Win=131072 Len=536 TSval=65813 TSecr=65793"
"1676","66.184480","fe80::200:ff:fe00:51","fe80::200:ff:fe00:2","TCP","644","49153  >  8080 [ACK] Seq=87905 Ack=1 Win=131072 Len=536 TSval=65813 TSecr=65793"
"1680","66.189293","fe80::200:ff:fe00:51","fe80::200:ff:fe00:2","TCP","644","49153  >  8080 [ACK] Seq=88441 Ack=1 Win=131072 Len=536 TSval=65848 TSecr=65805"
"1681","66.192511","fe80::200:ff:fe00:51","fe80::200:ff:fe00:2","TCP","644","[TCP Retransmission] 49153  >  8080 [ACK] Seq=88441 Ack=1 Win=131072 Len=536 TSval=65848 TSecr=65805"
"1683","66.195844","fe80::200:ff:fe00:51","fe80::200:ff:fe00:2","TCP","644","49153  >  8080 [ACK] Seq=88977 Ack=1 Win=131072 Len=536 TSval=65848 TSecr=65805"
"1687","66.200877","fe80::200:ff:fe00:51","fe80::200:ff:fe00:2","TCP","644","49153  >  8080 [ACK] Seq=89513 Ack=1 Win=131072 Len=536 TSval=65848 TSecr=65805"
"1689","66.204270","fe80::200:ff:fe00:51","fe80::200:ff:fe00:2","TCP","644","49153  >  8080 [ACK] Seq=90049 Ack=1 Win=131072 Len=536 TSval=65849 TSecr=65819"
"1693","66.208863","fe80::200:ff:fe00:51","fe80::200:ff:fe00:2","TCP","644","49153  >  8080 [ACK] Seq=90585 Ack=1 Win=131072 Len=536 TSval=65849 TSecr=65819"
"1695","66.212476","fe80::200:ff:fe00:51","fe80::200:ff:fe00:2","TCP","644","49153  >  8080 [ACK] Seq=91121 Ack=1 Win=131072 Len=536 TSval=65849 TSecr=65819"
"1696","66.215774","fe80::200:ff:fe00:51","fe80::200:ff:fe00:2","TCP","644","[TCP Retransmission] 49153  >  8080 [ACK] Seq=91121 Ack=1 Win=131072 Len=536 TSval=65849 TSecr=65819"
"1697","66.221172","fe80::200:ff:fe00:51","fe80::200:ff:fe00:2","TCP","644","[TCP Retransmission] 49153  >  8080 [ACK] Seq=91121 Ack=1 Win=131072 Len=536 TSval=65849 TSecr=65819"
"1699","66.226881","fe80::200:ff:fe00:51","fe80::200:ff:fe00:2","TCP","644","49153  >  8080 [ACK] Seq=91657 Ack=1 Win=131072 Len=536 TSval=65869 TSecr=65836"
"1702","66.234976","fe80::200:ff:fe00:51","fe80::200:ff:fe00:2","TCP","644","[TCP Retransmission] 49153  >  8080 [ACK] Seq=91657 Ack=1 Win=131072 Len=536 TSval=65869 TSecr=65836"
"1704","66.240824","fe80::200:ff:fe00:51","fe80::200:ff:fe00:2","TCP","644","49153  >  8080 [ACK] Seq=92193 Ack=1 Win=131072 Len=536 TSval=65869 TSecr=65836"
"1708","66.248173","fe80::200:ff:fe00:51","fe80::200:ff:fe00:2","TCP","644","49153  >  8080 [ACK] Seq=92729 Ack=1 Win=131072 Len=536 TSval=65869 TSecr=65836"
"1710","66.254242","fe80::200:ff:fe00:51","fe80::200:ff:fe00:2","TCP","644","49153  >  8080 [ACK] Seq=93265 Ack=1 Win=131072 Len=536 TSval=65870 TSecr=65847"
"1712","66.259951","fe80::200:ff:fe00:51","fe80::200:ff:fe00:2","TCP","644","49153  >  8080 [ACK] Seq=93801 Ack=1 Win=131072 Len=536 TSval=65870 TSecr=65847"
"1715","66.267786","fe80::200:ff:fe00:51","fe80::200:ff:fe00:2","TCP","644","[TCP Retransmission] 49153  >  8080 [ACK] Seq=93801 Ack=1 Win=131072 Len=536 TSval=65870 TSecr=65847"
"1717","66.273855","fe80::200:ff:fe00:51","fe80::200:ff:fe00:2","TCP","644","49153  >  8080 [ACK] Seq=94337 Ack=1 Win=131072 Len=536 TSval=65870 TSecr=65847"
"1721","66.281484","fe80::200:ff:fe00:51","fe80::200:ff:fe00:2","TCP","644","49153  >  8080 [ACK] Seq=94873 Ack=1 Win=131072 Len=536 TSval=65889 TSecr=65862"
"1723","66.287653","fe80::200:ff:fe00:51","fe80::200:ff:fe00:2","TCP","644","49153  >  8080 [ACK] Seq=95409 Ack=1 Win=131072 Len=536 TSval=65889 TSecr=65862"
"1727","66.294370","fe80::200:ff:fe00:51","fe80::200:ff:fe00:2","TCP","644","49153  >  8080 [ACK] Seq=95945 Ack=1 Win=131072 Len=536 TSval=65889 TSecr=65862"
"1729","66.300299","fe80::200:ff:fe00:51","fe80::200:ff:fe00:2","TCP","644","49153  >  8080 [ACK] Seq=96481 Ack=1 Win=131072 Len=536 TSval=65896 TSecr=65876"
"1731","66.306168","fe80::200:ff:fe00:51","fe80::200:ff:fe00:2","TCP","644","49153  >  8080 [ACK] Seq=97017 Ack=1 Win=131072 Len=536 TSval=65896 TSecr=65876"
"1735","66.313285","fe80::200:ff:fe00:51","fe80::200:ff:fe00:2","TCP","644","49153  >  8080 [ACK] Seq=97553 Ack=1 Win=131072 Len=536 TSval=65896 TSecr=65876"
"1739","66.320482","fe80::200:ff:fe00:51","fe80::200:ff:fe00:2","TCP","644","49153  >  8080 [ACK] Seq=98089 Ack=1 Win=131072 Len=536 TSval=65901 TSecr=65888"
"1741","66.324195","fe80::200:ff:fe00:51","fe80::200:ff:fe00:2","TCP","644","49153  >  8080 [ACK] Seq=98625 Ack=1 Win=131072 Len=536 TSval=65901 TSecr=65888"
"1742","66.328273","fe80::200:ff:fe00:51","fe80::200:ff:fe00:2","TCP","644","[TCP Retransmission] 49153  >  8080 [ACK] Seq=98625 Ack=1 Win=131072 Len=536 TSval=65901 TSecr=65888"
"1746","66.332454","fe80::200:ff:fe00:51","fe80::200:ff:fe00:2","TCP","644","49153  >  8080 [ACK] Seq=99161 Ack=1 Win=131072 Len=536 TSval=65901 TSecr=65888"
"1748","66.336147","fe80::200:ff:fe00:51","fe80::200:ff:fe00:2","TCP","644","49153  >  8080 [ACK] Seq=99697 Ack=1 Win=131072 Len=536 TSval=65908 TSecr=65907"
"1752","66.340688","fe80::200:ff:fe00:51","fe80::200:ff:fe00:2","TCP","644","49153  >  8080 [ACK] Seq=100233 Ack=1 Win=131072 Len=536 TSval=65908 TSecr=65907"
"1753","66.344246","fe80::200:ff:fe00:51","fe80::200:ff:fe00:2","TCP","644","[TCP Retransmission] 49153  >  8080 [ACK] Seq=100233 Ack=1 Win=131072 Len=536 TSval=65908 TSecr=65907"
"1755","66.347539","fe80::200:ff:fe00:51","fe80::200:ff:fe00:2","TCP","644","49153  >  8080 [ACK] Seq=100769 Ack=1 Win=131072 Len=536 TSval=65908 TSecr=65907"
"1759","66.352120","fe80::200:ff:fe00:51","fe80::200:ff:fe00:2","TCP","644","49153  >  8080 [ACK] Seq=101305 Ack=1 Win=131072 Len=536 TSval=65921 TSecr=65920"
"1761","66.355813","fe80::200:ff:fe00:51","fe80::200:ff:fe00:2","TCP","644","49153  >  8080 [ACK] Seq=101841 Ack=1 Win=131072 Len=536 TSval=65921 TSecr=65920"
"1762","66.359771","fe80::200:ff:fe00:51","fe80::200:ff:fe00:2","TCP","644","[TCP Retransmission] 49153  >  8080 [ACK] Seq=101841 Ack=1 Win=131072 Len=536 TSval=65921 TSecr=65920"
"1763","66.364209","fe80::200:ff:fe00:51","fe80::200:ff:fe00:2","TCP","644","[TCP Retransmission] 49153  >  8080 [ACK] Seq=101841 Ack=1 Win=131072 Len=536 TSval=65921 TSecr=65920"
"1767","66.371046","fe80::200:ff:fe00:51","fe80::200:ff:fe00:2","TCP","644","49153  >  8080 [ACK] Seq=102377 Ack=1 Win=131072 Len=536 TSval=65921 TSecr=65920"
"1769","66.377335","fe80::200:ff:fe00:51","fe80::200:ff:fe00:2","TCP","644","49153  >  8080 [ACK] Seq=102913 Ack=1 Win=131072 Len=536 TSval=65946 TSecr=65933"
"1773","66.384572","fe80::200:ff:fe00:51","fe80::200:ff:fe00:2","TCP","644","49153  >  8080 [ACK] Seq=103449 Ack=1 Win=131072 Len=536 TSval=65946 TSecr=65933"
"1775","66.390781","fe80::200:ff:fe00:51","fe80::200:ff:fe00:2","TCP","644","49153  >  8080 [ACK] Seq=103985 Ack=1 Win=131072 Len=536 TSval=65946 TSecr=65933"
"1779","66.397797","fe80::200:ff:fe00:51","fe80::200:ff:fe00:2","TCP","644","49153  >  8080 [ACK] Seq=104521 Ack=1 Win=131072 Len=536 TSval=65947 TSecr=65945"
"1781","66.404046","fe80::200:ff:fe00:51","fe80::200:ff:fe00:2","TCP","644","49153  >  8080 [ACK] Seq=105057 Ack=1 Win=131072 Len=536 TSval=65947 TSecr=65945"
"1785","66.411363","fe80::200:ff:fe00:51","fe80::200:ff:fe00:2","TCP","644","49153  >  8080 [ACK] Seq=105593 Ack=1 Win=131072 Len=536 TSval=65947 TSecr=65945"
"1787","66.417552","fe80::200:ff:fe00:51","fe80::200:ff:fe00:2","TCP","644","49153  >  8080 [ACK] Seq=106129 Ack=1 Win=131072 Len=536 TSval=65960 TSecr=65959"
"1791","66.425569","fe80::200:ff:fe00:51","fe80::200:ff:fe00:2","TCP","644","49153  >  8080 [ACK] Seq=106665 Ack=1 Win=131072 Len=536 TSval=65960 TSecr=65959"
"1793","66.431758","fe80::200:ff:fe00:51","fe80::200:ff:fe00:2","TCP","644","49153  >  8080 [ACK] Seq=107201 Ack=1 Win=131072 Len=536 TSval=65960 TSecr=65959"
"1794","66.435356","fe80::200:ff:fe00:51","fe80::200:ff:fe00:2","TCP","644","[TCP Retransmission] 49153  >  8080 [ACK] Seq=107201 Ack=1 Win=131072 Len=536 TSval=65960 TSecr=65959"
"1798","66.442213","fe80::200:ff:fe00:51","fe80::200:ff:fe00:2","TCP","644","49153  >  8080 [ACK] Seq=107737 Ack=1 Win=131072 Len=536 TSval=65996 TSecr=65976"
"1800","66.448302","fe80::200:ff:fe00:51","fe80::200:ff:fe00:2","TCP","644","49153  >  8080 [ACK] Seq=108273 Ack=1 Win=131072 Len=536 TSval=65996 TSecr=65976"
"1802","66.455499","fe80::200:ff:fe00:51","fe80::200:ff:fe00:2","TCP","644","49153  >  8080 [ACK] Seq=108809 Ack=1 Win=131072 Len=536 TSval=65996 TSecr=65976"
"1804","66.461488","fe80::200:ff:fe00:51","fe80::200:ff:fe00:2","TCP","644","49153  >  8080 [ACK] Seq=109345 Ack=1 Win=131072 Len=536 TSval=66020 TSecr=65988"
